[
  {
    "contract_version": "0.4.0",
    "cost_record_id": "cost-74-creative",
    "tenant_id": "tenant-a",
    "app_id": "app-a",
    "network": "synthetic-network",
    "campaign_id": "campaign-a",
    "date": "2026-08-06",
    "amount_unscaled": "10000000",
    "amount_scale": 6,
    "currency": "USD",
    "source": "imported_reported",
    "as_of": "2026-08-12T00:00:00.000Z",
    "report_snapshot_digest": "00503d14394f1a0617810c5e279a862b783a98674f6e6e8dac61973eccbe076a",
    "dimension_digest": "ff07ed1baffc483df63e0f0d9111eca700de92223d16f0e2151d7b697cc3ea7b",
    "ad_group_id": "synthetic-group-a",
    "creative_id": "synthetic-creative-a",
    "coverage_scope": "matching_detail_only"
  },
  {
    "contract_version": "0.4.0",
    "cost_record_id": "cost-74-group",
    "tenant_id": "tenant-a",
    "app_id": "app-a",
    "network": "synthetic-network",
    "campaign_id": "campaign-a",
    "date": "2026-08-06",
    "amount_unscaled": "15000000",
    "amount_scale": 6,
    "currency": "USD",
    "source": "imported_reported",
    "as_of": "2026-08-13T00:00:00.000Z",
    "report_snapshot_digest": "994461afe501ee0f848470f04c9ee69c7c6ff9115588b7fcc7dbd2b736a4b557",
    "dimension_digest": "20cbe75bef27cdea80d34ca943ec92d72e1bf6fa85b30b94e2902f731a68b92e",
    "ad_group_id": "synthetic-group-a",
    "coverage_scope": "matching_detail_only"
  },
  {
    "contract_version": "0.4.0",
    "cost_record_id": "cost-74-parent",
    "tenant_id": "tenant-a",
    "app_id": "app-a",
    "network": "synthetic-network",
    "campaign_id": "campaign-a",
    "date": "2026-08-06",
    "amount_unscaled": "30000000",
    "amount_scale": 6,
    "currency": "USD",
    "source": "imported_reported",
    "as_of": "2026-08-14T00:00:00.000Z",
    "report_snapshot_digest": "d617630d8cf838c17e96f56331ef023767f79cc24e45e6b3e61b262ddb3a269b",
    "dimension_digest": "2e042377815dad9abbc979c5608c3f369f00fd6ae7acbad56da2aa1eada2d1df"
  }
]
