[
  {
    "contract_version": "0.4.0",
    "cost_record_id": "cost-68-imported-jst",
    "tenant_id": "tenant-a",
    "app_id": "app-a",
    "network": "synthetic-export-network",
    "campaign_id": "synthetic-imported-68",
    "date": "2026-08-07",
    "reporting_time_zone": "Asia/Tokyo",
    "amount_unscaled": "2000000",
    "amount_scale": 6,
    "currency": "USD",
    "source": "imported_reported",
    "as_of": "2026-08-15T00:00:00.000Z",
    "report_snapshot_digest": "6666666666666666666666666666666666666666666666666666666666666666",
    "dimension_digest": "1248dd174bf6b426a810c05595d3ef589c279a01ace6c8386719944fd1bdcf0b"
  },
  {
    "contract_version": "0.4.0",
    "cost_record_id": "cost-68-imported-ny",
    "tenant_id": "tenant-a",
    "app_id": "app-a",
    "network": "synthetic-export-network",
    "campaign_id": "synthetic-imported-68",
    "date": "2026-08-06",
    "reporting_time_zone": "America/New_York",
    "amount_unscaled": "2000000",
    "amount_scale": 6,
    "currency": "USD",
    "source": "imported_reported",
    "as_of": "2026-08-15T00:00:00.000Z",
    "report_snapshot_digest": "6666666666666666666666666666666666666666666666666666666666666666",
    "dimension_digest": "1e998aa03b8d4150a72bd3f9157b4e04c4a89d2b2c4a5473fe4128a90cc0ce2c"
  },
  {
    "contract_version": "0.4.0",
    "cost_record_id": "cost-68-imported-utc",
    "tenant_id": "tenant-a",
    "app_id": "app-a",
    "network": "synthetic-export-network",
    "campaign_id": "synthetic-imported-68",
    "date": "2026-08-06",
    "reporting_time_zone": "UTC",
    "amount_unscaled": "2000000",
    "amount_scale": 6,
    "currency": "USD",
    "source": "imported_reported",
    "as_of": "2026-08-15T00:00:00.000Z",
    "report_snapshot_digest": "6666666666666666666666666666666666666666666666666666666666666666",
    "dimension_digest": "9c03a8a1e61376dd4c3a49324f9c29db3ec43454e67db0f59f408c6f0e4ff89c"
  },
  {
    "contract_version": "0.4.0",
    "cost_record_id": "cost-68-meta-jst",
    "tenant_id": "tenant-a",
    "app_id": "app-a",
    "network": "meta_install_referrer",
    "campaign_id": "synthetic-platform-68",
    "date": "2026-08-07",
    "reporting_time_zone": "Asia/Tokyo",
    "amount_unscaled": "2000000",
    "amount_scale": 6,
    "currency": "USD",
    "source": "imported_reported",
    "as_of": "2026-08-15T00:00:00.000Z",
    "report_snapshot_digest": "6666666666666666666666666666666666666666666666666666666666666666",
    "dimension_digest": "107841cfd603c55e5924dad566dd097cafab3abd3b8bccbe2dcca4966d968069"
  },
  {
    "contract_version": "0.4.0",
    "cost_record_id": "cost-68-meta-ny",
    "tenant_id": "tenant-a",
    "app_id": "app-a",
    "network": "meta_install_referrer",
    "campaign_id": "synthetic-platform-68",
    "date": "2026-08-06",
    "reporting_time_zone": "America/New_York",
    "amount_unscaled": "2000000",
    "amount_scale": 6,
    "currency": "USD",
    "source": "imported_reported",
    "as_of": "2026-08-15T00:00:00.000Z",
    "report_snapshot_digest": "6666666666666666666666666666666666666666666666666666666666666666",
    "dimension_digest": "1e8ee6ae7e84ef5fa3523f85b2fca79d0748253db62963a79befb5657e39807f"
  },
  {
    "contract_version": "0.4.0",
    "cost_record_id": "cost-68-meta-utc",
    "tenant_id": "tenant-a",
    "app_id": "app-a",
    "network": "meta_install_referrer",
    "campaign_id": "synthetic-platform-68",
    "date": "2026-08-06",
    "reporting_time_zone": "UTC",
    "amount_unscaled": "2000000",
    "amount_scale": 6,
    "currency": "USD",
    "source": "imported_reported",
    "as_of": "2026-08-15T00:00:00.000Z",
    "report_snapshot_digest": "6666666666666666666666666666666666666666666666666666666666666666",
    "dimension_digest": "0b45f07fcb3d5876dfdd04ca84db628f9b21ce6ab228c1bbcd05ef17ee2f9449"
  },
  {
    "contract_version": "0.4.0",
    "cost_record_id": "cost-68-native-jst",
    "tenant_id": "tenant-a",
    "app_id": "app-a",
    "network": "synthetic-network",
    "campaign_id": "synthetic-native-68",
    "date": "2026-08-07",
    "reporting_time_zone": "Asia/Tokyo",
    "amount_unscaled": "2000000",
    "amount_scale": 6,
    "currency": "USD",
    "source": "imported_reported",
    "as_of": "2026-08-15T00:00:00.000Z",
    "report_snapshot_digest": "6666666666666666666666666666666666666666666666666666666666666666",
    "dimension_digest": "2b46e2e4b5089000d3295296467e3315bdb47801b6eae099daa8b93bea72ded7"
  },
  {
    "contract_version": "0.4.0",
    "cost_record_id": "cost-68-native-ny",
    "tenant_id": "tenant-a",
    "app_id": "app-a",
    "network": "synthetic-network",
    "campaign_id": "synthetic-native-68",
    "date": "2026-08-06",
    "reporting_time_zone": "America/New_York",
    "amount_unscaled": "2000000",
    "amount_scale": 6,
    "currency": "USD",
    "source": "imported_reported",
    "as_of": "2026-08-15T00:00:00.000Z",
    "report_snapshot_digest": "6666666666666666666666666666666666666666666666666666666666666666",
    "dimension_digest": "1796de70d8157c7cfd57af242657555f6f5184eadc58ad77fc2070960d739fca"
  },
  {
    "contract_version": "0.4.0",
    "cost_record_id": "cost-68-native-utc",
    "tenant_id": "tenant-a",
    "app_id": "app-a",
    "network": "synthetic-network",
    "campaign_id": "synthetic-native-68",
    "date": "2026-08-06",
    "reporting_time_zone": "UTC",
    "amount_unscaled": "2000000",
    "amount_scale": 6,
    "currency": "USD",
    "source": "imported_reported",
    "as_of": "2026-08-15T00:00:00.000Z",
    "report_snapshot_digest": "6666666666666666666666666666666666666666666666666666666666666666",
    "dimension_digest": "6a0378ad34f9bab1c9fb1d9a9f111f8ac8ff438063d4862c7f4a543beab9535e"
  }
]
